{
  "$schema": "../theme.schema.json",
  "name": "neutral",
  "label": "Neutral",
  "description": "Default brand-agnostic theme.",
  "modes": {
    "light": {
      "background": "oklch(1 0 0)",
      "foreground": "oklch(0.145 0 0)",
      "card": "oklch(1 0 0)",
      "card-foreground": "oklch(0.145 0 0)",
      "popover": "oklch(1 0 0)",
      "popover-foreground": "oklch(0.145 0 0)",
      "primary": "oklch(0.205 0 0)",
      "primary-foreground": "oklch(0.985 0 0)",
      "secondary": "oklch(0.97 0 0)",
      "secondary-foreground": "oklch(0.205 0 0)",
      "muted": "oklch(0.97 0 0)",
      "muted-foreground": "oklch(0.53 0 0)",
      "overlay": "oklch(0 0 0 / 10%)",
      "accent": "oklch(0.97 0 0)",
      "accent-foreground": "oklch(0.205 0 0)",
      "destructive": "oklch(0.48 0.19 27.325)",
      "border": "oklch(0.922 0 0)",
      "input": "oklch(0.922 0 0)",
      "ring": "oklch(0.45 0 0)",
      "chart-1": "oklch(0.87 0 0)",
      "chart-2": "oklch(0.556 0 0)",
      "chart-3": "oklch(0.439 0 0)",
      "chart-4": "oklch(0.371 0 0)",
      "chart-5": "oklch(0.269 0 0)",
      "radius": "0.625rem",
      "sidebar": "oklch(0.985 0 0)",
      "sidebar-foreground": "oklch(0.145 0 0)",
      "sidebar-primary": "oklch(0.205 0 0)",
      "sidebar-primary-foreground": "oklch(0.985 0 0)",
      "sidebar-accent": "oklch(0.97 0 0)",
      "sidebar-accent-foreground": "oklch(0.205 0 0)",
      "sidebar-border": "oklch(0.922 0 0)",
      "sidebar-ring": "oklch(0.708 0 0)"
    },
    "dark": {
      "background": "oklch(0.145 0 0)",
      "foreground": "oklch(0.985 0 0)",
      "card": "oklch(0.205 0 0)",
      "card-foreground": "oklch(0.985 0 0)",
      "popover": "oklch(0.205 0 0)",
      "popover-foreground": "oklch(0.985 0 0)",
      "primary": "oklch(0.922 0 0)",
      "primary-foreground": "oklch(0.205 0 0)",
      "secondary": "oklch(0.269 0 0)",
      "secondary-foreground": "oklch(0.985 0 0)",
      "muted": "oklch(0.269 0 0)",
      "muted-foreground": "oklch(0.708 0 0)",
      "overlay": "oklch(0 0 0 / 55%)",
      "accent": "oklch(0.269 0 0)",
      "accent-foreground": "oklch(0.985 0 0)",
      "destructive": "oklch(0.704 0.191 22.216)",
      "border": "oklch(1 0 0 / 10%)",
      "input": "oklch(1 0 0 / 15%)",
      "ring": "oklch(0.75 0 0)",
      "chart-1": "oklch(0.87 0 0)",
      "chart-2": "oklch(0.556 0 0)",
      "chart-3": "oklch(0.439 0 0)",
      "chart-4": "oklch(0.371 0 0)",
      "chart-5": "oklch(0.269 0 0)",
      "radius": "0.625rem",
      "sidebar": "oklch(0.205 0 0)",
      "sidebar-foreground": "oklch(0.985 0 0)",
      "sidebar-primary": "oklch(0.922 0 0)",
      "sidebar-primary-foreground": "oklch(0.205 0 0)",
      "sidebar-accent": "oklch(0.269 0 0)",
      "sidebar-accent-foreground": "oklch(0.985 0 0)",
      "sidebar-border": "oklch(1 0 0 / 10%)",
      "sidebar-ring": "oklch(0.556 0 0)"
    }
  }
}
