{
  "$schema": "../theme.schema.json",
  "name": "tis",
  "label": "TIS",
  "description": "Optional standalone identity preset. It does not import or depend on ds-tis.",
  "modes": {
    "light": {
      "background": "#ffffff",
      "foreground": "#101828",
      "card": "#ffffff",
      "card-foreground": "#101828",
      "popover": "#ffffff",
      "popover-foreground": "#101828",
      "primary": "#0056e0",
      "primary-foreground": "#ffffff",
      "secondary": "#eaf2ff",
      "secondary-foreground": "#003a99",
      "muted": "#f2f4f7",
      "muted-foreground": "#475467",
      "overlay": "#10182833",
      "accent": "#e6efff",
      "accent-foreground": "#003a99",
      "destructive": "#b42318",
      "border": "#d0d5dd",
      "input": "#98a2b3",
      "ring": "#0056e0",
      "chart-1": "#0056e0",
      "chart-2": "#0086c9",
      "chart-3": "#7a5af8",
      "chart-4": "#12b76a",
      "chart-5": "#f79009",
      "radius": "0.625rem",
      "sidebar": "#f8fafc",
      "sidebar-foreground": "#101828",
      "sidebar-primary": "#0056e0",
      "sidebar-primary-foreground": "#ffffff",
      "sidebar-accent": "#eaf2ff",
      "sidebar-accent-foreground": "#003a99",
      "sidebar-border": "#d0d5dd",
      "sidebar-ring": "#0056e0"
    },
    "dark": {
      "background": "#0c111d",
      "foreground": "#f2f4f7",
      "card": "#161b26",
      "card-foreground": "#f2f4f7",
      "popover": "#161b26",
      "popover-foreground": "#f2f4f7",
      "primary": "#84adff",
      "primary-foreground": "#002661",
      "secondary": "#1d2939",
      "secondary-foreground": "#f2f4f7",
      "muted": "#1d2939",
      "muted-foreground": "#98a2b3",
      "overlay": "#000000b3",
      "accent": "#102a56",
      "accent-foreground": "#d1e0ff",
      "destructive": "#f97066",
      "border": "#344054",
      "input": "#475467",
      "ring": "#84adff",
      "chart-1": "#84adff",
      "chart-2": "#53b1fd",
      "chart-3": "#b692f6",
      "chart-4": "#47cd89",
      "chart-5": "#fdb022",
      "radius": "0.625rem",
      "sidebar": "#161b26",
      "sidebar-foreground": "#f2f4f7",
      "sidebar-primary": "#84adff",
      "sidebar-primary-foreground": "#002661",
      "sidebar-accent": "#102a56",
      "sidebar-accent-foreground": "#d1e0ff",
      "sidebar-border": "#344054",
      "sidebar-ring": "#84adff"
    }
  }
}
